<? xml version="1.0" encoding="utf-8"?>
<!DOCTYPE student SYSTEM "exstudent.dtd" >  
  <student>
    <name> 
      <firstname> Rohit </firstname>
      <lastname> D </lastname>
    </name>
    <rollno> 007 </rollno>
    <DOB> 0-0-00 </DOB>
    <address>
      <building> KK TuwErs </building>
      <street> mow street </street>
      <city> cape towm </city>
      <postalcode> 999999 </postalcode>
    </address>
    <course> CSE </course>
    
  </student>
